{
  "$id": "https://vibespec.vibecodeunited.com/schema/ui-components.schema.json",
  "$schema": "https://json-schema.org/draft/2020-12/schema",
  "type": "object",
  "properties": {
    "theme": {
      "type": "object"
    },
    "pages": {
      "type": "array",
      "items": {
        "type": "object",
        "required": [
          "id",
          "route"
        ],
        "properties": {
          "id": {
            "type": "string"
          },
          "route": {
            "type": "string"
          },
          "layout": {
            "type": "string"
          },
          "sections": {
            "type": "array",
            "items": {
              "type": "object"
            }
          }
        },
        "additionalProperties": false
      }
    },
    "components": {
      "type": "array",
      "items": {
        "type": "object",
        "required": [
          "type"
        ],
        "properties": {
          "type": {
            "type": "string"
          },
          "props_schema": {
            "type": "object"
          }
        },
        "additionalProperties": false
      }
    },
    "extensions": {
      "type": "object"
    }
  },
  "additionalProperties": false
}